id,product_name,category,review
1,Coffee Maker,Kitchen,"I picked this up on a whim, the timer is straightforward, and it has been super reliable. I expected average and got better than average. I had a similar item before and this one is easier to use. One weird thing: the cable is shorter than I wanted. Overall, I'm happy with this purchase."
2,Running Shoes,Fitness,"they felt broken-in pretty quickly, but it has inconsistent quality. The material picks up dust and scratches way too easily. Compared with my last one, this somehow feels cheaper. love love."
3,Portable Charger,Electronics,"For the price, the display is helpful, and it does exactly what I needed. I've dropped it once already and it still looks fine."
4,Yoga Mat,Fitness,"after a week, the cushioning feels balanced, and it holds up better than expected. The finish still looks clean after daily use. I've tried two similar products and this lands somewhere in the middle. Super, I'm happy with this purchase."
5,Wireless Mouse,Electronics,"scrolling feels controlled, and it saved me a lot of time. The finish still looks clean after daily use. Ngl, I'm happy with this purchase."
6,Portable Charger,Electronics,"the display is helpful, and it made a noticeable difference! Setup took maybe five minutes! Minor note: it fingerprints pretty easily!"
7,Stainless Steel Pan,Kitchen,"After two months, cleanup is easier than I expected, and I would recommend it with a couple caveats! Buttons and controls feel responsive! I've tried two similar products and this lands somewhere in the middle! If you catch it on sale, it's easier to recommend!"
8,Monitor Arm,Office,"Not gonna lie, it freed up desk space, but it keeps disconnecting randomly! The buttons feel mushy and inconsistent!"
9,Office Chair,Furniture,"lumbar support is noticeable, and I like using it, though quality control seems hit or miss. It runs a little warm, but not scary hot."
10,Yoga Mat,Fitness,"after two months, the cushioning feels balanced, but it is annoying to clean! Packaging was okay, but the product itself felt off! Pretty much, I expected more for the money! Might return it if the issue gets any worse! lol"
11,Monitor Arm,Office,"i bought this for work, adjustments are straightforward, and it actually made my routine easier. Buttons and controls feel responsive. One weird thing: the cable is shorter than I wanted."
12,Coffee Maker,Kitchen,"After two months, the timer is straightforward, and it saved me a lot of time! Buttons and controls feel responsive! Compared with my last one, this somehow feels cheaper! Tiny complaint, the packaging was overkill! fast fast!"
13,Wireless Earbuds,Electronics,"the mic is usable for calls, and it works fine most of the time, then randomly acts up. The finish still looks clean after daily use. Also, the color is a little darker than the listing."
14,Stainless Steel Pan,Kitchen,"I bought this for work, cleanup is easier than I expected, but it started making an odd noise. fast fast."
15,Monitor Arm,Office,"After a week, adjustments are straightforward, and it fits perfectly. It feels like someone actually tested this before shipping it. I expected it to be worse than my previous one, but it wasn't. One weird thing: the cable is shorter than I wanted."
16,Mechanical Keyboard,Electronics,"Tried it right out of the box, the switch feel is consistent, and it has great battery life! One weird thing: the cable is shorter than I wanted! Pretty much, I'm happy with this purchase!"
17,Stainless Steel Pan,Kitchen,"I was skeptical at first, it heats evenly once preheated, and there's a lot to like here, but it isn't perfect. Compared with my last one, this somehow feels cheaper. One weird thing: the cable is shorter than I wanted."
18,Wireless Mouse,Electronics,"so far, tracking is smooth, but it wobbles more than it should. Packaging was okay, but the product itself felt off. Compared with my last one, this somehow feels cheaper."
19,Laptop Stand,Office,"it keeps the screen at a better height, but it wobbles more than it should! The photos online make it look nicer than it is! Compared with my old one, this is a clear upgrade!"
20,Pet Hair Remover,Home,"the handle is comfortable, and I like using it, though quality control seems hit or miss. If you catch it on sale, it's easier to recommend."
21,Coffee Maker,Kitchen,"I use this almost every day, the timer is straightforward, and it saved me a lot of time. Tiny complaint, the packaging was overkill. Pretty much, I'm happy with this purchase. lol"
22,Monitor Arm,Office,"it holds position well, and it works really well. No weird squeaks, no rattling, no drama. This replaced a name-brand version and honestly kept up. It runs a little warm, but not scary hot."
23,Phone Case,Electronics,"I grabbed this during a sale, the grip is decent, and I would recommend it with a couple caveats. The material picks up dust and scratches way too easily. If you catch it on sale, it's easier to recommend."
24,Stainless Steel Pan,Kitchen,"Quick review, the handle stays comfortable, and it is comfortable even after long use. Setup took maybe five minutes. Compared with my last one, this somehow feels cheaper."
25,Water Bottle,Outdoors,"I wanted to love this, it keeps drinks cold for hours, but it is annoying to clean. It worked on day one and then slowly got worse. Kinda, I expected more for the money. lol"
26,Backpack,Travel,"Quick review, there's enough room for a laptop and charger, and I like using it, though quality control seems hit or miss. Compared with my old one, this is a clear upgrade. If you catch it on sale, it's easier to recommend."
27,Laptop Stand,Office,"I grabbed this during a sale, it folds flat for travel, and the design is smart, but the materials feel average. There was this faint plastic smell that didn't go away for days."
28,Wireless Mouse,Electronics,"I picked this up on a whim, scrolling feels controlled, and the design is smart, but the materials feel average. No weird squeaks, no rattling, no drama. I expected it to be worse than my previous one, but it wasn't. Minor note: it fingerprints pretty easily. If you catch it on sale, it's easier to recommend. lol"
29,Bluetooth Speaker,Electronics,"bass is okay for the size, and it works really well. Super, I'm happy with this purchase."
30,Pet Hair Remover,Home,"Been using it daily, cleanup is quick, and the design is smart, but the materials feel average. The finish still looks clean after daily use."
31,Wireless Earbuds,Electronics,"My partner uses this too, the mic is usable for calls, but it feels cheap in the hand. The material picks up dust and scratches way too easily. This replaced a name-brand version and honestly kept up."
32,Stainless Steel Pan,Kitchen,"the handle stays comfortable, and it does exactly what I needed. bad bad."
33,Running Shoes,Fitness,"arch support is decent, but it showed up with a weird smell. Customer support replied slowly and didn't really help. Kinda, I expected more for the money."
34,Mechanical Keyboard,Electronics,"the keys sound satisfying, and it feels surprisingly premium. The finish still looks clean after daily use. The texture is nicer than it looks in the photos. Legit, I'm happy with this purchase. love love."
35,Monitor Arm,Office,"I grabbed this during a sale, the clamp feels secure, and the design is smart, but the materials feel average. The photos online make it look nicer than it is. Compared with my last one, this somehow feels cheaper. If you catch it on sale, it's easier to recommend."
36,Vacuum Cleaner,Home,"I use this almost every day, it handles pet hair decently, but it doesnt fit as well as advertised! The material picks up dust and scratches way too easily! I expected it to be worse than my previous one, but it wasn't!"
37,Office Chair,Furniture,"Honestly, assembly was manageable, but it arrived scratched. It worked on day one and then slowly got worse. I expected it to be worse than my previous one, but it wasn't."
38,Desk Lamp,Home,"I bought this for work, it doesn't take much desk space, and it has been super reliable. Nothing fancy, just solid and dependable. I've tried two similar products and this lands somewhere in the middle."
39,Water Bottle,Outdoors,"First impression, it fits in my bag side pocket, and it feels surprisingly premium. A bit, im happy with this purchase. love love."
40,Office Chair,Furniture,"I use this almost every day, assembly was manageable, and it feels surprisingly premium. It feels like someone actually tested this before shipping it. Tiny complaint, the packaging was overkill. Legit, I'm happy with this purchase."
41,Skincare Serum,Beauty,"so far, it layers well under moisturizer, and it does the job, just not as smoothly as I'd hoped. The instructions were clear for once. Compared with my last one, this somehow feels cheaper. If you catch it on sale, it's easier to recommend."
42,Desk Lamp,Home,"I picked this up on a whim, it doesn't take much desk space, and it does the job, just not as smoothly as I'd hoped. Customer support replied slowly and didn't really help. If you catch it on sale, it's easier to recommend."
43,Portable Charger,Electronics,"I use this almost every day, it got me through a full day out, and performance is good, but the finish scratches easily. The material picks up dust and scratches way too easily. Tiny complaint, the packaging was overkill."
44,Wireless Mouse,Electronics,"the shape fits my hand, but it was kinda disappointing overall. The finish started wearing off almost immediately. Basically, I expected more for the money."
45,Coffee Maker,Kitchen,"I use this almost every day, cleanup isn't terrible, and it works fine most of the time, then randomly acts up."
46,Stainless Steel Pan,Kitchen,"I was skeptical at first, cleanup is easier than I expected, but it was kinda disappointing overall! Packaging was okay, but the product itself felt off! I expected it to be worse than my previous one, but it wasn't! Low-key, I expected more for the money!"
47,Water Bottle,Outdoors,"Real talk, it keeps drinks cold for hours, and it holds up better than expected. Ngl, I'm happy with this purchase."
48,Office Chair,Furniture,"Quick review, lumbar support is noticeable, and it made a noticeable difference. Nothing fancy, just solid and dependable. It runs a little warm, but not scary hot. lol"
49,Skincare Serum,Beauty,"First impression, a little goes a long way, and the design is smart, but the materials feel average. There was this faint plastic smell that didn't go away for days. This replaced a name-brand version and honestly kept up."
50,Office Chair,Furniture,"wheels roll smoothly, and I like using it, though quality control seems hit or miss. I expected average and got better than average. One weird thing: the cable is shorter than I wanted."
51,Laptop Stand,Office,"it folds flat for travel, and it has great battery life. The finish still looks clean after daily use."
52,Wireless Earbuds,Electronics,"Tried it right out of the box, the mic is usable for calls, and it does exactly what I needed. The instructions were clear for once. Ngl, I'm happy with this purchase. lol"
53,Yoga Mat,Fitness,"Real talk, the cushioning feels balanced, but it has inconsistent quality. Honestly it feels like a rushed design."
54,Running Shoes,Fitness,"Not gonna lie, they felt broken-in pretty quickly, and the design is smart, but the materials feel average. It runs a little warm, but not scary hot."
55,Portable Charger,Electronics,"Tried it right out of the box, charging speed is decent, but it drains faster than expected. Honestly it feels like a rushed design."
56,Mechanical Keyboard,Electronics,"I bought this for work, the backlight is clean, but it didn't live up to the hype. Packaging was okay, but the product itself felt off. I had a similar item before and this one is easier to use. Super, I expected more for the money. love love."
57,Yoga Mat,Fitness,"the cushioning feels balanced, but it was missing a small part."
58,Mechanical Keyboard,Electronics,"Quick review, the backlight is clean, and performance is good, but the finish scratches easily. I expected it to be worse than my previous one, but it wasn't. The texture is nicer than it looks in the photos."
59,Mechanical Keyboard,Electronics,"I grabbed this during a sale, the backlight is clean, but it is annoying to clean. The finish started wearing off almost immediately."
60,Stainless Steel Pan,Kitchen,"I grabbed this during a sale, it browned food nicely, and it looks better in person."
61,Mechanical Keyboard,Electronics,"for the price, the backlight is clean, and the main function is solid but the little details need work. The instructions were clear for once. If you catch it on sale, it's easier to recommend."
62,Laptop Stand,Office,"I grabbed this during a sale, it keeps the screen at a better height, and it does the job, just not as smoothly as I'd hoped. Compared with my last one, this somehow feels cheaper."
63,Coffee Maker,Kitchen,"Honestly, cleanup isn't terrible, but it is annoying to clean. Packaging was okay, but the product itself felt off. Compared with my old one, this is a clear upgrade. Legit, I expected more for the money."
64,Monitor Arm,Office,"I was skeptical at first, it holds position well, and it packs nicely for travel. Setup took maybe five minutes. I had a similar item before and this one is easier to use. meh meh. lol"
65,Wireless Earbuds,Electronics,"I grabbed this during a sale, the case snaps shut nicely, and it fits perfectly! meh meh!"
66,Backpack,Travel,"the zipper feels decent, but it keeps disconnecting randomly. I had to fiddle with it every single time. Legit, I expected more for the money."
67,Wireless Earbuds,Electronics,"for the price, the mic is usable for calls, and it feels surprisingly premium. I expected average and got better than average."
68,Desk Lamp,Home,"I bought this for work, the arm adjusts easily, and it actually made my routine easier. The instructions were clear for once. I expected it to be worse than my previous one, but it wasn't."
69,Pet Hair Remover,Home,"Been using it daily, it actually picks up fur, but it has inconsistent quality! The photos online make it look nicer than it is!"
70,Monitor Arm,Office,"I wanted to love this, adjustments are straightforward, and it cleans up fast. Even my picky friend said it was good. Kinda, I'm happy with this purchase. lol"
71,Bluetooth Speaker,Electronics,"been using it daily, volume gets loud enough for a small room, but it showed up with a weird smell. The buttons feel mushy and inconsistent. I've tried two similar products and this lands somewhere in the middle."
72,Backpack,Travel,"the pockets are laid out well, and I would recommend it with a couple caveats. The finish still looks clean after daily use. I had a similar item before and this one is easier to use. If you catch it on sale, it's easier to recommend."
73,Bluetooth Speaker,Electronics,"pairing was painless, and it is quieter than I expected. The finish still looks clean after daily use. I had a similar item before and this one is easier to use. The texture is nicer than it looks in the photos. Basically, I'm happy with this purchase."
74,Bluetooth Speaker,Electronics,"Quick review, pairing was painless, but it keeps disconnecting randomly. Customer support replied slowly and didn't really help. I've tried two similar products and this lands somewhere in the middle. Overall, I expected more for the money."
75,Wireless Mouse,Electronics,"After a week, the shape fits my hand, and it actually made my routine easier. It feels like someone actually tested this before shipping it."
76,Laptop Stand,Office,"Tried it right out of the box, it folds flat for travel, but it feels cheap in the hand. The buttons feel mushy and inconsistent. I had a similar item before and this one is easier to use. Super, I expected more for the money. good good."
77,Phone Case,Electronics,"the grip is decent, but it keeps disconnecting randomly. There was this faint plastic smell that didnt go away for days. Compared with my old one, this is a clear upgrade. lol"
78,Running Shoes,Fitness,"Not gonna lie, traction is good on wet pavement, and I would recommend it with a couple caveats. This replaced a name-brand version and honestly kept up. If you catch it on sale, it's easier to recommend."
79,Wireless Mouse,Electronics,"First impression, scrolling feels controlled, and performance is good, but the finish scratches easily. Even my picky friend said it was good. I've tried two similar products and this lands somewhere in the middle."
80,Laptop Stand,Office,"my neck feels better, but it wobbles more than it should. Packaging was okay, but the product itself felt off. Compared with my last one, this somehow feels cheaper."
81,Coffee Maker,Kitchen,"I was skeptical at first, coffee comes out hot, but it keeps disconnecting randomly."
82,Phone Case,Electronics,"I picked this up on a whim, the camera cutout lines up fine, and it is comfortable even after long use. Tiny complaint, the packaging was overkill."
83,Running Shoes,Fitness,"they're lighter than they look, and I like using it, though quality control seems hit or miss. Weirdly enough, the smell went away after a day. If you catch it on sale, it's easier to recommend."
84,Wireless Earbuds,Electronics,"I was skeptical at first, the mic is usable for calls, and it works fine most of the time, then randomly acts up. The finish started wearing off almost immediately."
85,Air Fryer,Kitchen,"the basket is easy enough to wash, and I like using it, though qualty control seems hit or miss. Buttons and controls feel responsive. The zipper/snaps/lid could be smoother. love love."
86,Bluetooth Speaker,Electronics,"Tried it right out of the box, sound is fuller than expected, and it feels surprisinglyy premium. It feels like someone actually tested this before shipping it. The zipper/snaps/lid could be smoother."
87,Mechanical Keyboard,Electronics,"After a week, the backlight is clean, but it is more flimsy than the photos! really really!"
88,Yoga Mat,Fitness,"after two months, it rolls up easily, and I like using it, though quality control seems hit or miss. Customer support replied slowly and didn't really help."
89,Backpack,Travel,"Tried it right out of the box, the zipper feels decent, and the design is smart, but the materials feel average. It worked on day one and then slowly got worse. Compared with my old one, this is a clear upgrade."
90,Portable Charger,Electronics,"I use this almost every day, it fits in a jacket pocket, and it made a noticeable difference! The instructions were clear for once! Minor note: it fingerprints pretty easily!"
91,Bluetooth Speaker,Electronics,"My partner uses this too, sound is fuller than expected, and it cleans up fast. The finish still looks clean after daily use. Compared with my old one, this is a clear upgrade. It runs a little warm, but not scary hot."
92,Running Shoes,Fitness,"For the price, traction is good on wet pavement, and it fits perfectly. Compared with my last one, this somehow feels cheaper."
93,Wireless Mouse,Electronics,"Not gonna lie, battery life seems decent so far, and it made a noticeable difference. I expected average and got better than average. This replaced a name-brand version and honestly kept up. Basically, I'm happy with this purchase."
94,Running Shoes,Fitness,"traction is good on wet pavement, and I would recommend it with a couple caveats. Weirdly enough, the smell went away after a day."
95,Coffee Maker,Kitchen,"the timer is straightforward, and the design is smart, but the materials feel average! The material picks up dust and scratches way too easily! If you catch it on sale, it's easier to recommend!"
96,Bluetooth Speaker,Electronics,"sound is fuller than expected, and I like using it, though quality control seems hit or miss."
97,Bluetooth Speaker,Electronics,"sound is fuller than expected, but it didn't live up to the hype. Customer support replied slowly and didn't really help. I've tried two similar products and this lands somewhere in the middle. Overall, I expected more for the money."
98,Stainless Steel Pan,Kitchen,"first impression, the handle stays comfortable, and it has great battery life. Kinda, I'm happy with this purchase."
99,Stainless Steel Pan,Kitchen,"it browned food nicely, and it holds up better than expected. One weird thing: the cable is shorter than I wanted."
100,Air Fryer,Kitchen,"it cooks evenly for the most part, and I like using it, though quality control seems hit or miss! Tiny complaint, the packaging was overkill!"
101,Mechanical Keyboard,Electronics,"the backlight is clean, and I would recommend it with a couple caveats. I expected average and got better than average. really really."
102,Phone Case,Electronics,"i use this almost every day, it doesn't add too much bulk, and it works really well. This replaced a name-brand version and honestly kept up."
103,Stainless Steel Pan,Kitchen,"it heats evenly once preheated, and it looks better in person. This replaced a name-brand version and honestly kept up."
104,Air Fryer,Kitchen,"First impression, preheat time is short, and I would recommend it with a couple caveats. I had a similar item before and this one is easier to use."
105,Desk Lamp,Home,"i wanted to love this, the light output is solid, but it wobbles more than it should. Packaging was okay, but the product itself felt off."
106,Monitor Arm,Office,"Quick review, adjustments are straightforward, but it is annoying to clean. The buttons feel mushy and inconsistent. I had a similar item before and this one is easier to use."
107,Phone Case,Electronics,"I grabbed this during a sale, it doesn't add too much bulk, and the design is smart, but the materials feel average. Nothing fancy, just solid and dependable."
108,Mechanical Keyboard,Electronics,"Tried it right out of the box, the backlight is clean, and it saved me a lot of time. Buttons and controls feel responsive. This replaced a name-brand version and honestly kept up."
109,Portable Charger,Electronics,"the display is helpful, and there's a lot to like here, but it isn't perfect. The buttons feel mushy and inconsistent. I had a similar item before and this one is easier to use."
110,Coffee Maker,Kitchen,"I picked this up on a whim, coffee comes out hot, but it is annoying to clean! Packaging was okay, but the product itself felt off! This replaced a name-brand version and honestly kept up! Might return it if the issue gets any worse!"
111,Office Chair,Furniture,"Tried it right out of the box, the seat cushion is better than expected, but it arrived scratched. The buttons feel mushy and inconsistent. Kinda, I expected more for the money."
112,Portable Charger,Electronics,"Tried it right out of the box, charging speed is decent, and the main function is solid but the little details need work. The material picks up dust and scratches way too easily. I've tried two similar products and this lands somewhere in the middle."
113,Water Bottle,Outdoors,"Not gonna lie, it keeps drinks cold for hours, and I would recommend it with a couple caveats. If you catch it on sale, it's easier to recommend."
114,Coffee Maker,Kitchen,"I wanted to love this, the timer is straightforward, and it works really well. I've dropped it once already and it still looks fine. This replaced a name-brand version and honestly kept up. meh meh."
115,Water Bottle,Outdoors,"Tried it right out of the box, it keeps drinks cold for hours, and it is comfortable even after long use. I've dropped it once already and it still looks fine. Compared with my last one, this somehow feels cheaper."
116,Backpack,Travel,"After a week, the zipper feels decent, and I would recommend it with a couple caveats! Packaging was okay, but the product itself felt off! If you catch it on sale, it's easier to recommend!"
117,Skincare Serum,Beauty,"a little goes a long way, but it feels cheap in the hand. There was this faint plastic smell that didnt go away for days. lol"
118,Backpack,Travel,"For the price, the straps are comfortable, but it feels cheap in the hand. I had a similar item before and this one is easier to use. Legit, I expected more for the money."
119,Running Shoes,Fitness,"they're lighter than they look, and performance is good, but the finish scratches easily!"
120,Mechanical Keyboard,Electronics,"the backlight is clean, and the design is smart, but the materials feel average."
121,Coffee Maker,Kitchen,"Honestly, the timer is straightforward, and it saved me a lot of time! It feels like someone actually tested this before shipping it! I expected it to be worse than my previous one, but it wasn't!"
122,Phone Case,Electronics,"the grip is decent, and it has great battery life. Even my picky friend said it was good. Compared with my last one, this somehow feels cheaper."
123,Stainless Steel Pan,Kitchen,"it browned food nicely, but it keeps disconnecting randomly. I had to fiddle with it every single time. I had a similar item before and this one is easier to use. Overall, I expected more for the money."
124,Stainless Steel Pan,Kitchen,"I was skeptical at first, the handle stays comfortable, and it fits perfectly. I've dropped it once already and it still looks fine. Compared with my old one, this is a clear upgrade."
125,Wireless Earbuds,Electronics,"the mic is usable for calls, and it actually made my routine easier. Even my picky friend said it was good. Compared with my old one, this is a clear upgrade. Tiny complaint, the packaging was overkill. really really."
126,Mechanical Keyboard,Electronics,"the switch feel is consistent, but it looks nice but performance is meh. The material picks up dust and scratches way too easily. This replaced a name-brand version and honestly kept up. meh meh."
