id,product_name,category,review
127,Bluetooth Speaker,Electronics,"volume gets loud enough for a small room, and it works really well. It feels like someone actually tested this before shipping it. Super, I'm happy with this purchase."
128,Office Chair,Furniture,"i use this almost every day, wheels roll smoothly, and I like using it, though quality control seems hit or miss. Compared with my last one, this somehow feels cheaper. lol"
129,Phone Case,Electronics,"i picked this up on a whim, the buttons are clicky, and I like using it, though quality control seems hit or miss! The material picks up dust and scratches way too easily! I've tried two similar products and this lands somewhere in the middle!"
130,Wireless Mouse,Electronics,"I was skeptical at first, battery life seems decent so far, but it has inconsistent quality. The buttons feel mushy and inconsistent. Basically, I expected more for the money."
131,Mechanical Keyboard,Electronics,"the keys sound satisfying, and it feels surprisingly premium. The finish still looks clean after daily use. I had a similar item before and this one is easier to use. Also, the color is a little darker than the listing."
132,Monitor Arm,Office,"I use this almost every day, it holds position well, and the main function is solid but the little details need work! Also, the color is a little darker than the listing! If you catch it on sale, it's easier to recommend!"
133,Portable Charger,Electronics,"I picked this up on a whim, it got me through a full day out, and I would recommend it with a couple caveats. The buttons feel mushy and inconsistent. If you catch it on sale, it's easier to recommend."
134,Portable Charger,Electronics,"been using it daily, it got me through a full day out, and the design is smart, but the materials feel average. I had to fiddle with it every single time. fast fast."
135,Portable Charger,Electronics,"Quick review, it fits in a jacket pocket, and I would recommend it with a couple caveats. No weird squeaks, no rattling, no drama. If you catch it on sale, it's easier to recommend. really really."
136,Yoga Mat,Fitness,"I wanted to love this, it doesn't smell as bad as some mats do, but it stopped working way too soon. I had to fiddle with it every single time."
137,Wireless Mouse,Electronics,"real talk, scrolling feels controlled, but it wobbles more than it should. The buttons feel mushy and inconsistent. Compared with my last one, this somehow feels cheaper."
138,Pet Hair Remover,Home,"cleanup is quick, and it has great battery life. It feels like someone actually tested this before shipping it. This replaced a name-brand version and honestly kept up."
139,Mechanical Keyboard,Electronics,"Quick review, the backlight is clean, and it has been super reliable. I expected it to be worse than my previous one, but it wasn't. Also, the color is a little darker than the listing."
140,Bluetooth Speaker,Electronics,"Tried it right out of the box, volume gets loud enough for a small room, but it was missing a small part. I had to fiddle with it every single time. Basically, I expected more for the money."
141,Yoga Mat,Fitness,"it grips the floor well, and performance is good, but the finish scratches easily. meh meh."
142,Bluetooth Speaker,Electronics,"I picked this up on a whim, volume gets loud enough for a small room, and it packs nicely for travel! Buttons and controls feel responsive!"
143,Coffee Maker,Kitchen,"For the price, cleanup isn't terrible, and I would recommend it with a couple caveats. Buttons and controls feel responsive. Compared with my old one, this is a clear upgrade."
144,Coffee Maker,Kitchen,"I picked this up on a whim, the timer is straightforward, but it has inconsistent quality. I had to fiddle with it every single time. Legit, I expected more for the money."
145,Bluetooth Speaker,Electronics,"I bought this for work, pairing was painless, and it does exactly what I needed. I expected average and got better than average. This replaced a name-brand version and honestly kept up. One weird thing: the cable is shorter than I wanted."
146,Skincare Serum,Beauty,"My partner uses this too, it didn't irritate my skin, and it is comfortable even after long use. love love."
147,Portable Charger,Electronics,"I grabbed this during a sale, the display is helpful, but it has inconsistent quality. Customer support replied slowly and didn't really help. I had a similar item before and this one is easier to use."
148,Office Chair,Furniture,"wheels roll smoothly, and it is easy to set up! Setup took maybe five minutes! Also, the color is a little darker than the listing!"
149,Stainless Steel Pan,Kitchen,"Been using it daily, cleanup is easier than I expected, but it feels cheap in the hand. The finish started wearing off almost immediately. Might return it if the issue gets any worse."
150,Yoga Mat,Fitness,"After two months, the cushioning feels balanced, and it does the job, just not as smoothly as I'd hoped!"
151,Phone Case,Electronics,"I grabbed this during a sale, the grip is decent, but it keeps disconnecting randomly. I expected it to be worse than my previous one, but it wasn't. lol"
152,Phone Case,Electronics,"the grip is decent, and I like using it, though quality control seems hit or miss. It worked on day one and then slowly got worse."
153,Wireless Earbuds,Electronics,"For the price, latency is okay for videos, and it actually made my routine easier. Setup took maybe five minutes. A bit, I'm happy with this purchase."
154,Bluetooth Speaker,Electronics,"I wanted to love this, pairing was painless, and I would recommend it with a couple caveats. Buttons and controls feel responsive. meh meh."
155,Running Shoes,Fitness,"they're lighter than they look, but it started making an odd noise. lol"
156,Water Bottle,Outdoors,"I picked this up on a whim, the mouth opening is easy to clean, and it does exactly what I needed! Setup took maybe five minutes! Compared with my old one, this is a clear upgrade! Tiny complaint, the packaging was overkill!"
157,Laptop Stand,Office,"After a week, my neck feels better, but it showed up with a weird smell! The photos online make it look nicer than it is! Compared with my last one, this somehow feels cheaper! fast fast!"
158,Laptop Stand,Office,"My partner uses this too, it keeps the screen at a better height, and performance is good, but the finish scratches easily. Compared with my old one, this is a clear upgrade."
159,Stainless Steel Pan,Kitchen,"Tried it right out of the box, it heats evenly once preheated, but it arrived scratched. Honestly it feels like a rushed design. bad bad."
160,Monitor Arm,Office,"For the price, it holds position well, and I like using it, though quality control seems hit or miss! I had to fiddle with it every single time! I've tried two similar products and this lands somewhere in the middle! The zipper/snaps/lid could be smoother! good good!"
161,Portable Charger,Electronics,"I was skeptical at first, it got me through a full day out, but it wobbles more than it should. The buttons feel mushy and inconsistent. good good."
162,Portable Charger,Electronics,"charging speed is decent, but it arrived scratched! It worked on day one and then slowly got worse! Compared with my old one, this is a clear upgrade! Might return it if the issue gets any worse!"
163,Vacuum Cleaner,Home,"Not gonna lie, the dust bin is easy enough to empty, and I would recommend it with a couple caveats! The photos online make it look nicer than it is! Compared with my last one, this somehow feels cheaper!"
164,Monitor Arm,Office,"After a week, the clamp feels secure, and it packs nicely for travel! Setup took maybe five minutes!"
165,Monitor Arm,Office,"it freed up desk space, and it holds up better than expected. Even my picky friend said it was good. Compared with my last one, this somehow feels cheaper. Also, the color is a little darker than the listing."
166,Air Fryer,Kitchen,"For the price, fries come out crisp, and it made a noticeable difference. Setup took maybe five minutes. I expected it to be worse than my previous one, but it wasn't. really really."
167,Running Shoes,Fitness,"Tried it right out of the box, arch support is decent, and it packs nicely for travel. Buttons and controls feel responsive."
168,Stainless Steel Pan,Kitchen,"it heats evenly once preheated, and it has great battery life. The finish still looks clean after daily use. Overall, im happy with this purchase."
169,Mechanical Keyboard,Electronics,"For the price, the switch feel is consistent, and performance is good, but the finish scratches easily. I had to fiddle with it every single time. I expected it to be worse than my previous one, but it wasn't. Minor note: it fingerprints pretty easily. If you catch it on sale, it's easier to recommend."
170,Air Fryer,Kitchen,"I bought this for work, preheat time is short, but it showed up with a weird smell. Customer support replied slowly and didn't really help. Might return it if the issue gets any worse."
171,Desk Lamp,Home,"So far, the arm adjusts easily, and I would recommend it with a couple caveats! The material picks up dust and scratches way too easily! Compared with my old one, this is a clear upgrade! If you catch it on sale, it's easier to recommend!"
172,Mechanical Keyboard,Electronics,"first impression, the keys sound satisfying, and it works really well. I've dropped it once already and it still looks fine. I had a similar item before and this one is easier to use."
173,Running Shoes,Fitness,"I wanted to love this, they felt broken-in pretty quickly, and the main function is solid but the little details need work. I expected it to be worse than my previous one, but it wasn't."
174,Wireless Mouse,Electronics,"tracking is smooth, and it holds up better than expected. Buttons and controls feel responsive. I expected it to be worse than my previous one, but it wasn't. Legit, I'm happy with this purchase."
175,Stainless Steel Pan,Kitchen,"cleanup is easier than I expected, and the design is smart, but the materials feel average. It feels like someone actually tested this before shipping it. If you catch it on sale, it's easier to recommend."
176,Office Chair,Furniture,"lumbar support is noticeable, but it has inconsistent quality. It worked on day one and then slowly got worse. I've tried two similar products and this lands somewhere in the middle. Pretty much, I expected more for the money."
177,Air Fryer,Kitchen,"Honestly, the basket is easy enough to wash, and I like using it, though quality control seems hit or miss. Buttons and controls feel responsive. Also, the color is a little darker than the listing. If you catch it on sale, it's easier to recommend. lol"
178,Laptop Stand,Office,"I wanted to love this, my neck feels better, and it works really well. Nothing fancy, just solid and dependable."
179,Laptop Stand,Office,"Real talk, it doesn't slide around much, and I would recommend it with a couple caveats! Honestly it feels like a rushed design! Minor note: it fingerprints pretty easily! lol"
180,Skincare Serum,Beauty,"i picked this up on a whim, it layers well under moisturizer, and it actually made my routine easier. The instructions were clear for once. This replaced a name-brand version and honestly kept up. One weird thing: the cable is shorter than I wanted."
181,Wireless Earbuds,Electronics,"pairing was quick, and it feels surprisingly premium! The finish still looks clean after daily use!"
182,Mechanical Keyboard,Electronics,"So far, the backlight is clean, and it works really well! The instructions were clear for once! Compared with my last one, this somehow feels cheaper! Tbh, I'm happy with this purchase!"
183,Vacuum Cleaner,Home,"Real talk, it handles pet hair decently, but it feels cheap in the hand. It worked on day one and then slowly got worse."
184,Portable Charger,Electronics,"the display is helpful, but it feels cheap in the hand! I had to fiddle with it every single time! I've tried two similar products and this lands somewhere in the middle! bad bad!"
185,Desk Lamp,Home,"Been using it daily, the light output is solid, and it works fine most of the time, then randomly acts up. The material picks up dust and scratches way too easily. Compared with my old one, this is a clear upgrade. The zipper/snaps/lid could be smoother. If you catch it on sale, it's easier to recommend."
186,Yoga Mat,Fitness,"i picked this up on a whim, it grips the floor well, and it works fine most of the time, then randomly acts up."
187,Phone Case,Electronics,"the grip is decent, but it showed up with a weird smell. lol"
188,Backpack,Travel,"Been using it daily, the pockets are laid out well, and performance is good, but the finish scratches easily. There was this faint plastic smell that didn't go away for days. This replaced a name-brand version and honestly kept up. meh meh."
189,Laptop Stand,Office,"After two months, my neck feels better, but it showed up with a weird smell. There was this faint plastic smell that didn't go away for days."
190,Pet Hair Remover,Home,"So far, cleanup is quick, but it keeps disconnecting randomly. Packaging was okay, but the product itself felt off. love love."
191,Mechanical Keyboard,Electronics,"the switch feel is consistent, and it has great battery life. The finish still looks clean after daily use. The zipper/snaps/lid could be smoother. Legit, I'm happy with this purchase."
192,Monitor Arm,Office,"it freed up desk space, and it is easy to set up. I've dropped it once already and it still looks fine. The zipper/snaps/lid could be smoother. Super, I'm happy with this purchase."
193,Coffee Maker,Kitchen,"i use this almost every day, the carafe pours without dripping most of the time, but it has inconsistent quality. lol"
194,Skincare Serum,Beauty,"I picked this up on a whim, it didn't irritate my skin, and it does the job, just not as smoothly as I'd hoped! Setup took maybe five minutes!"
195,Pet Hair Remover,Home,"Been using it daily, cleanup is quick, and it works fine most of the time, then randomly acts up. Weirdly enough, the smell went away after a day."
196,Yoga Mat,Fitness,"Tried it right out of the box, it rolls up easily, but it showed up with a weird smell. The material picks up dust and scratches way too easily."
197,Mechanical Keyboard,Electronics,"the switch feel is consistent, and I would recommend it with a couple caveats."
198,Skincare Serum,Beauty,"I picked this up on a whim, a little goes a long way, and I would recommend it with a couple caveats. There was this faint plastic smell that didn't go away for days. Compared with my old one, this is a clear upgrade."
199,Wireless Earbuds,Electronics,"Tried it right out of the box, latency is okay for videos, and it has great battery life. It feels like someone actually tested this before shipping it. Compared with my old one, this is a clear upgrade. bad bad."
200,Phone Case,Electronics,"I bought this for work, it doesn't add too much bulk, and it works fine most of the time, then randomly acts up! If you catch it on sale, it's easier to recommend!"
201,Phone Case,Electronics,"not gonna lie, the grip is decent, and it actually made my routine easier. It runs a little warm, but not scary hot."
202,Yoga Mat,Fitness,"the cushioning feels balanced, and the main function is solid but the little details need work. The texture is nicer than it looks in the photos. fast fast."
203,Desk Lamp,Home,"I was skeptical at first, it doesn't take much desk space, but it wobbles more than it should."
204,Laptop Stand,Office,"I was skeptical at first, it keeps the screen at a better height, and it has been super reliable. Setup took maybe five minutes. I've tried two similar products and this lands somewhere in the middle. Also, the color is a little darker than the listing. good good. lol"
205,Portable Charger,Electronics,"First impression, the display is helpful, and it works really well. The instructions were clear for once. Minor note: it fingerprints pretty easily."
206,Pet Hair Remover,Home,"I was skeptical at first, the handle is comfortable, and it cleans up fast! No weird squeaks, no rattling, no drama! I expected it to be worse than my previous one, but it wasn't! A bit, I'm happy with this purchase! meh meh!"
207,Wireless Earbuds,Electronics,"After two months, the case snaps shut nicely, and it does the job, just not as smoothly as I'd hoped. The photos online make it look nicer than it is. Minor note: it fingerprints pretty easily."
208,Phone Case,Electronics,"Not gonna lie, it doesn't add too much bulk, and it cleans up fast. One weird thing: the cable is shorter than I wanted. really really."
209,Bluetooth Speaker,Electronics,"sound is fuller than expected, but it didn't live up to the hype. Packaging was okay, but the product itself felt off. Might return it if the issue gets any worse."
210,Yoga Mat,Fitness,"the cushioning feels balanced, but it was kinda disappointing overall! I had a similar item before and this one is easier to use! Might return it if the issue gets any worse!"
211,Skincare Serum,Beauty,"the texture is lightweight, and it made a noticeable difference. It feels like someone actually tested this before shipping it. I've tried two similar products and this lands somewhere in the middle."
212,Pet Hair Remover,Home,"Not gonna lie, cleanup is quick, and it actually made my routine easier. I had a similar item before and this one is easier to use. The texture is nicer than it looks in the photos. bad bad."
213,Running Shoes,Fitness,"I use this almost every day, they're lighter than they look, and I would recommend it with a couple caveats. Setup took maybe five minutes. I had a similar item before and this one is easier to use. Also, the color is a little darker than the listing."
214,Running Shoes,Fitness,"So far, arch support is decent, and the design is smart, but the materials feel average. Honestly it feels like a rushed design. meh meh."
215,Desk Lamp,Home,"After two months, the light output is solid, but it has inconsistent quality. I had to fiddle with it every single time. I expected it to be worse than my previous one, but it wasn't. Tbh, I expected more for the money."
216,Skincare Serum,Beauty,"a little goes a long way, and it made a noticeable difference. Buttons and controls feel responsive. I've tried two similar products and this lands somewhere in the middle. It runs a little warm, but not scary hot."
217,Laptop Stand,Office,"I wanted to love this, it doesn't slide around much, and it is quieter than I expected."
218,Monitor Arm,Office,"I wanted to love this, adjustments are straightforward, and it saved me a lot of time. No weird squeaks, no rattling, no drama. Ngl, I'm happy with this purchase."
219,Office Chair,Furniture,"wheels roll smoothly, but it arrived scratched. Tbh, I expected more for the money. Might return it if the issue gets any worse."
220,Desk Lamp,Home,"So far, it doesn't take much desk space, but it started making an odd noise. Packaging was okay, but the product itself felt off. I had a similar item before and this one is easier to use. Overall, I expected more for the money."
221,Phone Case,Electronics,"I wanted to love this, the buttons are clicky, and the main function is solid but the little details need work. I had a similar item before and this one is easier to use."
222,Backpack,Travel,"After a week, there's enough room for a laptop and charger, and it is easy to set up! The instructions were clear for once! I had a similar item before and this one is easier to use! Weirdly enough, the smell went away after a day! Basically, im happy with this purchase!"
223,Air Fryer,Kitchen,"the basket is easy enough to wash, but it was kinda disappointing overall! There was this faint plastic smell that didn't go away for days! I've tried two similar products and this lands somewhere in the middle!"
224,Wireless Earbuds,Electronics,"the case snaps shut nicely, and it has great battery life! I've dropped it once already and it still looks fine!"
225,Pet Hair Remover,Home,"I wanted to love this, cleanup is quick, and it has been super reliable. I expected average and got better than average. The texture is nicer than it looks in the photos."
226,Wireless Earbuds,Electronics,"I grabbed this during a sale, pairing was quick, and performance is good, but the finish scratches easily. It worked on day one and then slowly got worse. If you catch it on sale, it's easier to recommend."
227,Wireless Earbuds,Electronics,"My partner uses this too, the case snaps shut nicely, and the main function is solid but the little details need work. No weird squeaks, no rattling, no drama. If you catch it on sale, it's easier to recommend."
228,Coffee Maker,Kitchen,"After a week, coffee comes out hot, but it is more flimsy than the photos. There was this faint plastic smell that didn't go away for days. I've tried two similar products and this lands somewhere in the middle. Might return it if the issue gets any worse."
229,Stainless Steel Pan,Kitchen,"I grabbed this during a sale, cleanup is easier than I expected, and it looks better in person. Even my picky friend said it was good. Minor note: it fingerprints pretty easily. Kinda, I'm happy with this purchase."
230,Yoga Mat,Fitness,"the cushioning feels balanced, and it is easy to set up! It feels like someone actually tested this before shipping it! Minor note: it fingerprints pretty easily!"
231,Stainless Steel Pan,Kitchen,"Been using it daily, it heats evenly once preheated, and it saved me a lot of time. Buttons and controls feel responsive. lol"
232,Air Fryer,Kitchen,"First impression, the basket is easy enough to wash, but it keeps disconnecting randomly. This replaced a name-brand version and honestly kept up. Pretty much, I expected more for the money."
233,Office Chair,Furniture,"tried it right out of the box, wheels roll smoothly, but it showed up with a weird smell. Honestly it feels like a rushed design. This replaced a name-brand version and honestly kept up. Might return it if the issue gets any worse."
234,Vacuum Cleaner,Home,"Quick review, it handles pet hair decently, and the main function is solid but the little details need work. There was this faint plastic smell that didn't go away for days."
235,Monitor Arm,Office,"Honestly, adjustments are straightforward, and it is easy to set up. Compared with my last one, this somehow feels cheaper. Minor note: it fingerprints pretty easily."
236,Yoga Mat,Fitness,"I was skeptical at first, it rolls up easily, and it fits perfectly. Buttons and controls feel responsive. The texture is nicer than it looks in the photos. Overall, I'm happy with this purchase."
237,Portable Charger,Electronics,"After a week, it fits in a jacket pocket, but it drains faster than expected. I had a similar item before and this one is easier to use."
238,Water Bottle,Outdoors,"Been using it daily, the lid seals well, and it looks better in person. Even my picky friend said it was good."
239,Skincare Serum,Beauty,"it layers well under moisturizer, and it holds up better than expected! It feels like someone actually tested this before shipping it! Also, the color is a little darker than the listing!"
240,Skincare Serum,Beauty,"the texture is lightweight, but it is more flimsy than the photos. Honestly it feels like a rushed design."
241,Monitor Arm,Office,"I wanted to love this, the clamp feels secure, and it does exactly what I needed! The finish still looks clean after daily use! Compared with my old one, this is a clear upgrade! It runs a little warm, but not scary hot!"
242,Stainless Steel Pan,Kitchen,"I use this almost every day, the handle stays comfortable, but it stopped working way too soon. fast fast."
243,Yoga Mat,Fitness,"After two months, it doesn't smell as bad as some mats do, but it didn't live up to the hype. It worked on day one and then slowly got worse. Basically, I expected more for the money."
244,Vacuum Cleaner,Home,"I wanted to love this, the dust bin is easy enough to empty, and it cleans up fast. The finish still looks clean after daily use. It runs a little warm, but not scary hot."
245,Stainless Steel Pan,Kitchen,"I grabbed this during a sale, it browned food nicely, but it was missing a small part."
246,Water Bottle,Outdoors,"I wanted to love this, it keeps drinks cold for hours, and it is easy to set up! Setup took maybe five minutes!"
247,Portable Charger,Electronics,"I was skeptical at first, it fits in a jacket pocket, and the main function is solid but the little details need work."
248,Pet Hair Remover,Home,"Not gonna lie, it actually picks up fur, but it doesn't fit as well as advertised. Packaging was okay, but the product itself felt off. Low-key, I expected more for the money."
249,Wireless Earbuds,Electronics,"i grabbed this during a sale, the case snaps shut nicely, but it doesn't fit as well as advertised. I expected it to be worse than my previous one, but it wasn't. bad bad."
250,Coffee Maker,Kitchen,"cleanup isn't terrible, and the design is smart, but the materials feel average."
251,Coffee Maker,Kitchen,"I picked this up on a whim, the timer is straightforward, and it has great battery life. Even my picky friend said it was good. Weirdly enough, the smell went away after a day. Tbh, I'm happy with this purchase."
252,Skincare Serum,Beauty,"it didn't irritate my skin, and it actually made my routine easier. I've dropped it once already and it still looks fine. Pretty much, I'm happy with this purchase."
253,Wireless Earbuds,Electronics,"Honestly, pairing was quick, but it was kinda disappointing overall. The material picks up dust and scratches way too easily."
254,Mechanical Keyboard,Electronics,"I was skeptical at first, the switch feel is consistent, and the design is smart, but the materials feel average. This replaced a name-brand version and honestly kept up."
