id,product_name,category,review
385,Bluetooth Speaker,Electronics,"not gonna lie, pairing was painless, and it holds up better than expected. The instructions were clear for once. Compared with my old one, this is a clear upgrade. Weirdly enough, the smell went away after a day."
386,Laptop Stand,Office,"it folds flat for travel, and it is easy to set up. Setup took maybe five minutes. Tbh, I'm happy with this purchase. lol"
387,Wireless Earbuds,Electronics,"the mic is usable for calls, and it holds up better than expected. I expected average and got better than average."
388,Coffee Maker,Kitchen,"Quick review, the timer is straightforward, and it works fine most of the time, then randomly acts up. I've dropped it once already and it still looks fine. If you catch it on sale, it's easier to recommend."
389,Bluetooth Speaker,Electronics,"Been using it daily, volume gets loud enough for a small room, but it doesn't fit as well as advertised! The material picks up dust and scratches way too easily! Basically, I expected more for the money! Might return it if the issue gets any worse!"
390,Portable Charger,Electronics,"it fits in a jacket pocket, and it has been super reliable. I've dropped it once already and it still looks fine."
391,Mechanical Keyboard,Electronics,"typing feels faster, and it packs nicely for travel. The finish still looks clean after daily use. One weird thing: the cable is shorter than I wanted."
392,Coffee Maker,Kitchen,"I was skeptical at first, coffee comes out hot, and I would recommend it with a couple caveats. There was this faint plastic smell that didnt go away for days. If you catch it on sale, it's easier to recommend. meh meh."
393,Backpack,Travel,"After a week, the straps are comfortable, but it has inconsistent quality. Customer support replied slowly and didn't really help."
394,Bluetooth Speaker,Electronics,"Quick review, volume gets loud enough for a small room, and it works really well."
395,Bluetooth Speaker,Electronics,"For the price, volume gets loud enough for a small room, but it showed up with a weird smell! There was this faint plastic smell that didn't go away for days!"
396,Wireless Mouse,Electronics,"First impression, battery life seems decent so far, and it saved me a lot of time. No weird squeaks, no rattling, no drama. Minor note: it fingerprints pretty easily."
397,Running Shoes,Fitness,"I wanted to love this, they're lighter than they look, and it saved me a lot of time. The finish still looks clean after daily use. One weird thing: the cable is shorter than I wanted. bad bad."
398,Pet Hair Remover,Home,"it actually picks up fur, and there's a lot to like here, but it isn't perfect. The finish still looks clean after daily use. Also, the color is a little darker than the listing."
399,Air Fryer,Kitchen,"Been using it daily, fries come out crisp, and I would recommend it with a couple caveats. No weird squeaks, no rattling, no drama. If you catch it on sale, it's easier to recommend."
400,Water Bottle,Outdoors,"the lid seals well, and it packs nicely for travel. Nothing fancy, just solid and dependable. Compared with my last one, this somehow feels cheaper. Weirdly enough, the smell went away after a day. A bit, I'm happy with this purchase."
401,Stainless Steel Pan,Kitchen,"first impression, it heats evenly once preheated, but it doesn't fit as well as advertised. The photos online make it look nicer than it is. Compared with my last one, this somehow feels cheaper."
402,Water Bottle,Outdoors,"I use this almost every day, it keeps drinks cold for hours, and it has great battery life. The instructions were clear for once. I expected it to be worse than my previous one, but it wasn't. Super, I'm happy with this purchase."
403,Vacuum Cleaner,Home,"My partner uses this too, it gets under the couch better than expected, and it looks better in person. Setup took maybe five minutes. Also, the color is a little darker than the listing. lol"
404,Portable Charger,Electronics,"the display is helpful, and it fits perfectly. I've tried two similar products and this lands somewhere in the middle. Weirdly enough, the smell went away after a day."
405,Coffee Maker,Kitchen,"I use this almost every day, the carafe pours without dripping most of the time, and it works fine most of the time, then randomly acts up. I had to fiddle with it every single time. I had a similar item before and this one is easier to use. lol"
406,Mechanical Keyboard,Electronics,"I use this almost every day, the keys sound satisfying, but it arrived scratched. The buttons feel mushy and inconsistent. Might return it if the issue gets any worse."
407,Phone Case,Electronics,"the buttons are clicky, but it wobbles more than it should! The finish started wearing off almost immediately!"
408,Water Bottle,Outdoors,"it keeps drinks cold for hours, and performance is good, but the finish scratches easily. The material picks up dust and scratches way too easily."
409,Water Bottle,Outdoors,"it fits in my bag side pocket, and it has been super reliable. Setup took maybe five minutes. Compared with my old one, this is a clear upgrade. The zipper/snaps/lid could be smoother."
410,Pet Hair Remover,Home,"Quick review, it works on the couch and car seats, and it does exactly what I needed. Setup took maybe five minutes. Compared with my old one, this is a clear upgrade. Kinda, I'm happy with this purchase."
411,Stainless Steel Pan,Kitchen,"My partner uses this too, the handle stays comfortable, and it actually made my routine easier. The instructions were clear for once. Compared with my last one, this somehow feels cheaper. really really."
412,Phone Case,Electronics,"Real talk, the camera cutout lines up fine, and it actually made my routine easier. It feels like someone actually tested this before shipping it. Legit, I'm happy with this purchase."
413,Office Chair,Furniture,"Honestly, wheels roll smoothly, and it has great battery life. No weird squeaks, no rattling, no drama. lol"
414,Yoga Mat,Fitness,"I wanted to love this, it doesn't smell as bad as some mats do, but it didn't live up to the hype."
415,Backpack,Travel,"I use this almost every day, there's enough room for a laptop and charger, and it is easy to set up. It feels like someone actually tested this before shipping it."
416,Wireless Mouse,Electronics,"I was skeptical at first, tracking is smooth, and it does exactly what I needed. The instructions were clear for once. Tiny complaint, the packaging was overkill."
417,Laptop Stand,Office,"my neck feels better, and the main function is solid but the little details need work. good good."
418,Stainless Steel Pan,Kitchen,"After two months, the handle stays comfortable, and it cleans up fast. No weird squeaks, no rattling, no drama."
419,Bluetooth Speaker,Electronics,"I use this almost every day, pairing was painless, and there's a lot to like here, but it isn't perfect. Even my picky friend said it was good."
420,Bluetooth Speaker,Electronics,"My partner uses this too, pairing was painless, and it works really well! Setup took maybe five minutes! Super, I'm happy with this purchase! lol"
421,Laptop Stand,Office,"I was skeptical at first, it folds flat for travel, and it works fine most of the time, then randomly acts up. There was this faint plastic smell that didn't go away for days."
422,Portable Charger,Electronics,"I grabbed this during a sale, it got me through a full day out, but it doesn't fit as well as advertised. love love."
423,Stainless Steel Pan,Kitchen,"i grabbed this during a sale, cleanup is easier than I expected, and it made a noticeable difference. Nothing fancy, just solid and dependable. I expected it to be worse than my previous one, but it wasn't. Low-key, I'm happy with this purchase."
424,Monitor Arm,Office,"After two months, the clamp feels secure, and it is comfortable even after long use. Setup took maybe five minutes."
425,Yoga Mat,Fitness,"First impression, it doesn't smell as bad as some mats do, and it made a noticeable difference. The instructions were clear for once. I expected it to be worse than my previous one, but it wasn't. The texture is nicer than it looks in the photos. lol"
426,Backpack,Travel,"I was skeptical at first, the zipper feels decent, but it drains faster than expected."
427,Monitor Arm,Office,"First impression, it freed up desk space, and it saved me a lot of time. Setup took maybe five minutes."
428,Phone Case,Electronics,"Tried it right out of the box, it doesn't add too much bulk, but it arrived scratched. Packaging was okay, but the product itself felt off. Basically, I expected more for the money."
429,Stainless Steel Pan,Kitchen,"it browned food nicely, and it actually made my routine easier. It feels like someone actually tested this before shipping it. It runs a little warm, but not scary hot."
430,Running Shoes,Fitness,"I wanted to love this, they felt broken-in pretty quickly, but it wobbles more than it should. I had to fiddle with it every single time. Compared with my old one, this is a clear upgrade."
431,Desk Lamp,Home,"i grabbed this during a sale, the light output is solid, but it started making an odd noise."
432,Stainless Steel Pan,Kitchen,"I bought this for work, the handle stays comfortable, and it packs nicely for travel! I expected average and got better than average! Kinda, I'm happy with this purchase!"
433,Coffee Maker,Kitchen,"Not gonna lie, cleanup isn't terrible, but it is more flimsy than the photos. I had to fiddle with it every single time. Super, I expected more for the money. lol"
434,Wireless Mouse,Electronics,"tracking is smooth, and it feels surprisingly premium. It feels like someone actually tested this before shipping it. good good."
435,Mechanical Keyboard,Electronics,"I grabbed this during a sale, the keys sound satisfying, and it does the job, just not as smoothly as I'd hoped. It runs a little warm, but not scary hot."
436,Water Bottle,Outdoors,"Real talk, the mouth opening is easy to clean, and the main function is solid but the little details need work. It feels like someone actually tested this before shipping it. Compared with my last one, this somehow feels cheaper. The zipper/snaps/lid could be smoother. If you catch it on sale, it's easier to recommend."
437,Monitor Arm,Office,"I grabbed this during a sale, it freed up desk space, and it is comfortable even after long use. The instructions were clear for once."
438,Wireless Mouse,Electronics,"Been using it daily, the shape fits my hand, and I would recommend it with a couple caveats. It feels like someone actually tested this before shipping it. I've tried two similar products and this lands somewhere in the middle. Also, the color is a little darker than the listing. good good."
439,Portable Charger,Electronics,"charging speed is decent, but it stopped working way too soon. Might return it if the issue gets any worse."
440,Vacuum Cleaner,Home,"I bought this for work, the dust bin is easy enough to empty, and it works really well. Setup took maybe five minutes."
441,Yoga Mat,Fitness,"I bought this for work, it grips the floor well, and it saved me a lot of time. Weirdly enough, the smell went away after a day."
442,Skincare Serum,Beauty,"After a week, it didn't irritate my skin, and it feels sturdy and well made!"
443,Stainless Steel Pan,Kitchen,"Real talk, it heats evenly once preheated, and I would recommend it with a couple caveats. The photos online make it look nicer than it is. I expected it to be worse than my previous one, but it wasn't."
444,Running Shoes,Fitness,"i wanted to love this, they felt broken-in pretty quickly, and it works really well! I've tried two similar products and this lands somewhere in the middle! Pretty much, I'm happy with this purchase!"
445,Vacuum Cleaner,Home,"I wanted to love this, it gets under the couch better than expected, but it is annoying to clean. It worked on day one and then slowly got worse. lol"
446,Coffee Maker,Kitchen,"after a week, coffee comes out hot, but it feels cheap in the hand. The buttons feel mushy and inconsistent. A bit, I expected more for the money. Might return it if the issue gets any worse."
447,Portable Charger,Electronics,"Real talk, the display is helpful, and it works really well. Buttons and controls feel responsive."
448,Coffee Maker,Kitchen,"I bought this for work, the timer is straightforward, and it made a noticeable difference! The finish still looks clean after daily use! Ngl, I'm happy with this purchase!"
449,Yoga Mat,Fitness,"the cushioning feels balanced, and it looks better in person! It feels like someone actually tested this before shipping it! This replaced a name-brand version and honestly kept up!"
450,Phone Case,Electronics,"I bought this for work, the grip is decent, but it is more flimsy than the photos. The finish started wearing off almost immediately."
451,Water Bottle,Outdoors,"it keeps drinks cold for hours, and it actually made my routine easier. Setup took maybe five minutes."
452,Portable Charger,Electronics,"Honestly, it fits in a jacket pocket, and it works really well. Setup took maybe five minutes. The zipper/snaps/lid could be smoother. Basically, I'm happy with this purchase."
453,Wireless Mouse,Electronics,"I grabbed this during a sale, the shape fits my hand, and I like using it, though quality control seems hit or miss. No weird squeaks, no rattling, no drama. Minor note: it fingerprints pretty easily. bad bad."
454,Monitor Arm,Office,"the clamp feels secure, and performance is good, but the finish scratches easily. Customer support replied slowly and didn't really help. It runs a little warm, but not scary hot."
455,Stainless Steel Pan,Kitchen,"I picked this up on a whim, it heats evenly once preheated, and it feels sturdy and well made. really really."
456,Monitor Arm,Office,"not gonna lie, it holds position well, and it cleans up fast. Buttons and controls feel responsive."
457,Backpack,Travel,"I bought this for work, the pockets are laid out well, but it wobbles more than it should! lol"
458,Skincare Serum,Beauty,"I wanted to love this, a little goes a long way, and it packs nicely for travel. The finish still looks clean after daily use. I had a similar item before and this one is easier to use. It runs a little warm, but not scary hot. A bit, I'm happy with this purchase."
459,Monitor Arm,Office,"Been using it daily, adjustments are straightforward, but it showed up with a weird smell. The material picks up dust and scratches way too easily. Compared with my last one, this somehow feels cheaper."
460,Pet Hair Remover,Home,"it works on the couch and car seats, and the main function is solid but the little details need work. This replaced a name-brand version and honestly kept up."
461,Laptop Stand,Office,"I bought this for work, it doesn't slide around much, and it does the job, just not as smoothly as I'd hoped. The finish started wearing off almost immediately."
462,Stainless Steel Pan,Kitchen,"First impression, cleanup is easier than I expected, and it works really well. Even my picky friend said it was good. I had a similar item before and this one is easier to use."
463,Laptop Stand,Office,"it folds flat for travel, and it fits perfectly. I had a similar item before and this one is easier to use. It runs a little warm, but not scary hot. Tbh, I'm happy with this purchase."
464,Stainless Steel Pan,Kitchen,"it browned food nicely, and it works really well. The instructions were clear for once. Low-key, I'm happy with this purchase. good good. lol"
465,Portable Charger,Electronics,"I grabbed this during a sale, it got me through a full day out, and it actually made my routine easier. The finish still looks clean after daily use. Pretty much, I'm happy with this purchase."
466,Desk Lamp,Home,"my partner uses this too, it doesn't take much desk space, but it started making an odd noise. Customer support replied slowly and didn't really help."
467,Running Shoes,Fitness,"traction is good on wet pavement, and it fits perfectly. Nothing fancy, just solid and dependable. Compared with my last one, this somehow feels cheaper."
468,Phone Case,Electronics,"it doesn't add too much bulk, and it is comfortable even after long use. The instructions were clear for once. A bit, I'm happy with this purchase."
469,Bluetooth Speaker,Electronics,"I was skeptical at first, sound is fuller than expected, but it looks nice but performance is meh! The finish started wearing off almost immediately! I've tried two similar products and this lands somewhere in the middle! love love!"
470,Office Chair,Furniture,"I picked this up on a whim, wheels roll smoothly, but it didn't live up to the hype! The photos online make it look nicer than it is! Kinda, I expected more for the money!"
471,Vacuum Cleaner,Home,"For the price, it handles pet hair decently, but it started making an odd noise. There was this faint plastic smell that didnt go away for days. I've tried two similar products and this lands somewhere in the middle. Overall, I expected more for the money."
472,Vacuum Cleaner,Home,"I bought this for work, it handles pet hair decently, and it cleans up fast. Compared with my old one, this is a clear upgrade."
473,Water Bottle,Outdoors,"i was skeptical at first, it keeps drinks cold for hours, and I would recommend it with a couple caveats! Honestly it feels like a rushed design! I expected it to be worse than my previous one, but it wasn't!"
474,Vacuum Cleaner,Home,"After a week, it gets under the couch better than expected, and it cleans up fast. I've dropped it once already and it still looks fine. I expected it to be worse than my previous one, but it wasn't."
475,Coffee Maker,Kitchen,"the carafe pours without dripping most of the time, but it didn't live up to the hype. The material picks up dust and scratches way too easily. Might return it if the issue gets any worse. fast fast."
476,Vacuum Cleaner,Home,"After two months, it gets under the couch better than expected, and it holds up better than expected. I've dropped it once already and it still looks fine. The texture is nicer than it looks in the photos."
477,Running Shoes,Fitness,"Been using it daily, traction is good on wet pavement, and the main function is solid but the little details need work! The photos online make it look nicer than it is! The texture is nicer than it looks in the photos!"
478,Mechanical Keyboard,Electronics,"I wanted to love this, typing feels faster, but it looks nice but performance is meh. The buttons feel mushy and inconsistent. Pretty much, I expected more for the money. Might return it if the issue gets any worse."
479,Backpack,Travel,"My partner uses this too, the pockets are laid out well, and it is easy to set up. I've dropped it once already and it still looks fine. I expected it to be worse than my previous one, but it wasn't. Weirdly enough, the smell went away after a day."
480,Yoga Mat,Fitness,"My partner uses this too, it doesnt smell as bad as some mats do, and it made a noticeable difference. The finish still looks clean after daily use."
481,Laptop Stand,Office,"Quick review, it doesn't slide around much, but it arrived scratched. I had to fiddle with it every single time. lol"
482,Yoga Mat,Fitness,"it doesnt smell as bad as some mats do, but it doesn't fit as well as advertised. The photos online make it look nicer than it is."
483,Yoga Mat,Fitness,"For the price, it grips the floor well, but it drains faster than expected. Kinda, I expected more for the money. lol"
484,Pet Hair Remover,Home,"Been using it daily, the handle is comfortable, but it has inconsistent quality. The buttons feel mushy and inconsistent."
485,Desk Lamp,Home,"Quick review, it doesn't take much desk space, but it wobbles more than it should. The buttons feel mushy and inconsistent. I expected it to be worse than my previous one, but it wasn't."
486,Office Chair,Furniture,"real talk, wheels roll smoothly, and it is comfortable even after long use. Nothing fancy, just solid and dependable. Compared with my last one, this somehow feels cheaper. Ngl, I'm happy with this purchase. fast fast."
487,Backpack,Travel,"the zipper feels decent, and it packs nicely for travel. It feels like someone actually tested this before shipping it. I've tried two similar products and this lands somewhere in the middle. Weirdly enough, the smell went away after a day. Tbh, I'm happy with this purchase."
488,Coffee Maker,Kitchen,"Honestly, coffee comes out hot, and it has been super reliable. Setup took maybe five minutes. I expected it to be worse than my previous one, but it wasn't."
489,Air Fryer,Kitchen,"the basket is easy enough to wash, and it works fine most of the time, then randomly acts up. Even my picky friend said it was good. If you catch it on sale, it's easier to recommend."
490,Coffee Maker,Kitchen,"I picked this up on a whim, cleanup isn't terrible, and the design is smart, but the materials feel average. The finish started wearing off almost immediately. If you catch it on sale, it's easier to recommend."
491,Air Fryer,Kitchen,"I use this almost every day, it cooks evenly for the most part, but it is more flimsy than the photos. The finish started wearing off almost immediately."
492,Skincare Serum,Beauty,"So far, it didn't irritate my skin, and the design is smart, but the materials feel average. I've tried two similar products and this lands somewhere in the middle."
493,Mechanical Keyboard,Electronics,"the keys sound satisfying, and it has been super reliable. Setup took maybe five minutes. This replaced a name-brand version and honestly kept up."
494,Laptop Stand,Office,"I use this almost every day, my neck feels better, and I would recommend it with a couple caveats."
495,Stainless Steel Pan,Kitchen,"I picked this up on a whim, the handle stays comfortable, and there's a lot to like here, but it isn't perfect. The instructions were clear for once. I expected it to be worse than my previous one, but it wasn't."
496,Phone Case,Electronics,"Quick review, the camera cutout lines up fine, but it keeps disconnecting randomly. Customer support replied slowly and didn't really help."
497,Office Chair,Furniture,"Tried it right out of the box, lumbar support is noticeable, but it feels cheap in the hand. The photos online make it look nicer than it is."
498,Portable Charger,Electronics,"the display is helpful, and it saved me a lot of time. Also, the color is a little darker than the listing."
499,Water Bottle,Outdoors,"I wanted to love this, the mouth opening is easy to clean, and the design is smart, but the materials feel average."
500,Laptop Stand,Office,"my neck feels better, and it is comfortable even after long use. Nothing fancy, just solid and dependable."
