id,product_name,category,review
255,Vacuum Cleaner,Home,"After two months, it gets under the couch better than expected, but it doesn't fit as well as advertised. The photos online make it look nicer than it is. This replaced a name-brand version and honestly kept up. A bit, I expected more for the money."
256,Portable Charger,Electronics,"First impression, the display is helpful, and it has been super reliable! I've dropped it once already and it still looks fine! Ngl, I'm happy with this purchase!"
257,Monitor Arm,Office,"I use this almost every day, it holds position well, but it was missing a small part. Honestly it feels like a rushed design. Compared with my old one, this is a clear upgrade. Might return it if the issue gets any worse."
258,Yoga Mat,Fitness,"Been using it daily, it rolls up easily, and it works really well. Even my picky friend said it was good. Basically, I'm happy with this purchase."
259,Running Shoes,Fitness,"Tried it right out of the box, they're lighter than they look, and I like using it, though quality control seems hit or miss. lol"
260,Desk Lamp,Home,"Quick review, it doesn't take much desk space, and the design is smart, but the materials feel average."
261,Wireless Earbuds,Electronics,"After two months, pairing was quick, and it actually made my routine easier! Setup took maybe five minutes! fast fast!"
262,Mechanical Keyboard,Electronics,"First impression, typing feels faster, and I like using it, though quality control seems hit or miss! The material picks up dust and scratches way too easily!"
263,Running Shoes,Fitness,"Real talk, traction is good on wet pavement, but it doesn't fit as well as advertised! It worked on day one and then slowly got worse!"
264,Office Chair,Furniture,"I use this almost every day, wheels roll smoothly, but it arrived scratched. I had to fiddle with it every single time."
265,Portable Charger,Electronics,"After a week, it got me through a full day out, and it does the job, just not as smoothly as I'd hoped. Honestly it feels like a rushed design. If you catch it on sale, it's easier to recommend."
266,Desk Lamp,Home,"my partner uses this too, it doesn't take much desk space, and it actually made my routine easier! Setup took maybe five minutes! I expected it to be worse than my previous one, but it wasn't! One weird thing: the cable is shorter than I wanted! lol"
267,Bluetooth Speaker,Electronics,"pairing was painless, and it packs nicely for travel. Setup took maybe five minutes. Compared with my last one, this somehow feels cheaper. It runs a little warm, but not scary hot. A bit, im happy with this purchase."
268,Mechanical Keyboard,Electronics,"typing feels faster, and it feels surprisingly premium. The instructions were clear for once."
269,Monitor Arm,Office,"Tried it right out of the box, adjustments are straightforward, and it cleans up fast! One weird thing: the cable is shorter than I wanted! Legit, I'm happy with this purchase!"
270,Vacuum Cleaner,Home,"I use this almost every day, it handles pet hair decently, and I would recommend it with a couple caveats. I had a similar item before and this one is easier to use. The texture is nicer than it looks in the photos. lol"
271,Coffee Maker,Kitchen,"I grabbed this during a sale, cleanup isn't terrible, and it packs nicely for travel. Setup took maybe five minutes. Kinda, I'm happy with this purchase."
272,Water Bottle,Outdoors,"My partner uses this too, it fits in my bag side pocket, but it has inconsistent quality. Customer support replied slowly and didn't really help."
273,Pet Hair Remover,Home,"i grabbed this during a sale, cleanup is quick, and it saved me a lot of time! Buttons and controls feel responsive! Weirdly enough, the smell went away after a day!"
274,Laptop Stand,Office,"After two months, it doesn't slide around much, and it saved me a lot of time! It feels like someone actually tested this before shipping it!"
275,Backpack,Travel,"the straps are comfortable, but it looks nice but performance is meh. Packaging was okay, but the product itself felt off. I've tried two similar products and this lands somewhere in the middle."
276,Desk Lamp,Home,"I was skeptical at first, the light output is solid, and it has been super reliable. I expected average and got better than average. Compared with my last one, this somehow feels cheaper. Ngl, I'm happy with this purchase."
277,Running Shoes,Fitness,"After two months, arch support is decent, and I like using it, though quality control seems hit or miss. Customer support replied slowly and didn't really help."
278,Air Fryer,Kitchen,"I bought this for work, it cooks evenly for the most part, but it was missing a small part. The finish started wearing off almost immediately."
279,Desk Lamp,Home,"I wanted to love this, the light output is solid, and there's a lot to like here, but it isn't perfect. really really."
280,Mechanical Keyboard,Electronics,"Quick review, typing feels faster, and it does exactly what I needed. Buttons and controls feel responsive. I've tried two similar products and this lands somewhere in the middle. meh meh."
281,Phone Case,Electronics,"Real talk, the camera cutout lines up fine, and performance is good, but the finish scratches easily. I've tried two similar products and this lands somewhere in the middle. lol"
282,Skincare Serum,Beauty,"I picked this up on a whim, it didn't irritate my skin, and it feels surprisingly premium. The finish still looks clean after daily use."
283,Phone Case,Electronics,"Quick review, the camera cutout lines up fine, but it didnt live up to the hype. The finish started wearing off almost immediately."
284,Bluetooth Speaker,Electronics,"sound is fuller than expected, and it has been super reliable. The finish still looks clean after daily use. Compared with my last one, this somehow feels cheaper. Also, the color is a little darker than the listing."
285,Running Shoes,Fitness,"arch support is decent, and it cleans up fast! The instructions were clear for once! Compared with my old one, this is a clear upgrade! Minor note: it fingerprints pretty easily!"
286,Vacuum Cleaner,Home,"I bought this for work, it handles pet hair decently, and it made a noticeable difference."
287,Wireless Mouse,Electronics,"Been using it daily, tracking is smooth, and it packs nicely for travel. Setup took maybe five minutes. I've tried two similar products and this lands somewhere in the middle. The texture is nicer than it looks in the photos. meh meh."
288,Air Fryer,Kitchen,"After a week, preheat time is short, but it started making an odd noise. The finish started wearing off almost immediately. Might return it if the issue gets any worse."
289,Yoga Mat,Fitness,"I was skeptical at first, it rolls up easily, and it feels surprisingly premium. The finish still looks clean after daily use. Overall, I'm happy with this purchase."
290,Monitor Arm,Office,"I picked this up on a whim, the clamp feels secure, and it does the job, just not as smoothly as I'd hoped. No weird squeaks, no rattling, no drama. Minor note: it fingerprints pretty easily. If you catch it on sale, it's easier to recommend."
291,Monitor Arm,Office,"First impression, adjustments are straightforward, and I would recommend it with a couple caveats. The buttons feel mushy and inconsistent. Compared with my last one, this somehow feels cheaper."
292,Wireless Mouse,Electronics,"First impression, the shape fits my hand, and it works really well. Tiny complaint, the packaging was overkill. good good."
293,Yoga Mat,Fitness,"I use this almost every day, the cushioning feels balanced, and it is easy to set up. Setup took maybe five minutes. Compared with my old one, this is a clear upgrade."
294,Running Shoes,Fitness,"I wanted to love this, they're lighter than they look, and it does the job, just not as smoothly as I'd hoped. Honestly it feels like a rushed design."
295,Phone Case,Electronics,"So far, the grip is decent, but it drains faster than expected. I had a similar item before and this one is easier to use. love love."
296,Water Bottle,Outdoors,"So far, the lid seals well, but it looks nice but performance is meh! The finish started wearing off almost immediately! I expected it to be worse than my previous one, but it wasn't! Basically, I expected more for the money!"
297,Skincare Serum,Beauty,"a little goes a long way, and performance is good, but the finish scratches easily. Customer support replied slowly and didn't really help. One weird thing: the cable is shorter than I wanted. meh meh."
298,Portable Charger,Electronics,"Not gonna lie, it fits in a jacket pocket, but it didn't live up to the hype. Customer support replied slowly and didn't really help. I've tried two similar products and this lands somewhere in the middle. Low-key, I expected more for the money."
299,Pet Hair Remover,Home,"I use this almost every day, cleanup is quick, and the main function is solid but the little details need work! I've dropped it once already and it still looks fine! fast fast!"
300,Backpack,Travel,"For the price, the straps are comfortable, and it looks better in person. really really."
301,Pet Hair Remover,Home,"My partner uses this too, it works on the couch and car seats, but it feels cheap in the hand! The photos online make it look nicer than it is! I had a similar item before and this one is easier to use!"
302,Air Fryer,Kitchen,"I bought this for work, fries come out crisp, but it showed up with a weird smell. There was this faint plastic smell that didn't go away for days."
303,Monitor Arm,Office,"First impression, the clamp feels secure, but it was kinda disappointing overall. Customer support replied slowly and didn't realy help. Low-key, I expected more for the money. meh meh."
304,Bluetooth Speaker,Electronics,"I grabbed this during a sale, volume gets loud enough for a small room, and it works really well. No weird squeaks, no rattling, no drama. Compared with my old one, this is a clear upgrade. The texture is nicer than it looks in the photos."
305,Backpack,Travel,"I use this almost every day, the zipper feels decent, and it feels surprisingly premium. Buttons and controls feel responsive. I had a similar item before and this one is easier to use."
306,Air Fryer,Kitchen,"I wanted to love this, the basket is easy enough to wash, but it is more flimsy than the photos! Compared with my old one, this is a clear upgrade!"
307,Desk Lamp,Home,"So far, it doesn't take much desk space, and it works fine most of the time, then randomly acts up. The material picks up dust and scratches way too easily. If you catch it on sale, it's easier to recommend. good good."
308,Office Chair,Furniture,"I wanted to love this, wheels roll smoothly, and there's a lot to like here, but it isn't perfect! Compared with my old one, this is a clear upgrade!"
309,Monitor Arm,Office,"So far, it freed up desk space, and it has great battery life. Setup took maybe five minutes. I've tried two similar products and this lands somewhere in the middle. Low-key, I'm happy with this purchase."
310,Wireless Mouse,Electronics,"Honestly, tracking is smooth, and it saved me a lot of time! I expected average and got better than average! Compared with my last one, this somehow feels cheaper!"
311,Phone Case,Electronics,"So far, the buttons are clicky, and it fits perfectly. The finish still looks clean after daily use. I've tried two similar products and this lands somewhere in the middle."
312,Stainless Steel Pan,Kitchen,"it browned food nicely, and it looks better in person. Buttons and controls feel responsive. This replaced a name-brand version and honestly kept up."
313,Yoga Mat,Fitness,"I wanted to love this, it rolls up easily, and it packs nicely for travel. The instructions were clear for once."
314,Coffee Maker,Kitchen,"Tried it right out of the box, the carafe pours without dripping most of the time, and it fits perfectly. I've dropped it once already and it still looks fine."
315,Bluetooth Speaker,Electronics,"I picked this up on a whim, volume gets loud enough for a small room, but it is more flimsy than the photos. Honestly it feels like a rushed design. Basically, I expected more for the money."
316,Coffee Maker,Kitchen,"Quick review, cleanup isn't terrible, but it was kinda disappointing overall! Packaging was okay, but the product itself felt off! Compared with my last one, this somehow feels cheaper!"
317,Portable Charger,Electronics,"I bought this for work, it fits in a jacket pocket, but it arrived scratched. The photos online make it look nicer than it is."
318,Laptop Stand,Office,"I grabbed this during a sale, my neck feels better, and the main function is solid but the little details need work."
319,Portable Charger,Electronics,"I bought this for work, the display is helpful, and it actually made my routine easier! I expected average and got better than average! This replaced a name-brand version and honestly kept up! Ngl, I'm happy with this purchase! lol"
320,Bluetooth Speaker,Electronics,"First impression, bass is okay for the size, and the design is smart, but the materials feel average."
321,Bluetooth Speaker,Electronics,"I picked this up on a whim, pairing was painless, but it wobbles more than it should! Kinda, I expected more for the money!"
322,Monitor Arm,Office,"it holds position well, and the design is smart, but the materials feel average. Honestly it feels like a rushed design. I had a similar item before and this one is easier to use."
323,Air Fryer,Kitchen,"My partner uses this too, it cooks evenly for the most part, but it keeps disconnecting randomly. The photos online make it look nicer than it is. Compared with my old one, this is a clear upgrade."
324,Skincare Serum,Beauty,"it layers well under moisturizer, and it is comfortable even after long use. Nothing fancy, just solid and dependable. lol"
325,Skincare Serum,Beauty,"For the price, it didn't irritate my skin, and there's a lot to like here, but it isn't perfect! Compared with my last one, this somehow feels cheaper!"
326,Office Chair,Furniture,"Quick review, lumbar support is noticeable, and the design is smart, but the materials feel average. I expected it to be worse than my previous one, but it wasn't."
327,Desk Lamp,Home,"the arm adjusts easily, but it drains faster than expected. I had to fiddle with it every single time. Legit, I expected more for the money. Might return it if the issue gets any worse."
328,Phone Case,Electronics,"For the price, the camera cutout lines up fine, and it feels sturdy and well made. No weird squeaks, no rattling, no drama. It runs a little warm, but not scary hot."
329,Water Bottle,Outdoors,"Honestly, it keeps drinks cold for hours, and it works really well! I expected average and got better than average! I had a similar item before and this one is easier to use! fast fast!"
330,Pet Hair Remover,Home,"After two months, it actually picks up fur, but it didn't live up to the hype. Honestly it feels like a rushed design. Tbh, I expected more for the money."
331,Wireless Mouse,Electronics,"I wanted to love this, scrolling feels controlled, and I like using it, though qualty control seems hit or miss. Compared with my old one, this is a clear upgrade."
332,Pet Hair Remover,Home,"After two months, the handle is comfy, and it is quieter than I expected. The instructions were clear for once. Tbh, I'm happy with this purchase. lol"
333,Vacuum Cleaner,Home,"Been using it daily, it handles pet hair decently, and I would recommend it with a couple caveats."
334,Stainless Steel Pan,Kitchen,"I use this almost every day, it heats evenly once preheated, and it cleans up fast. No weird squeaks, no rattling, no drama. I've tried two similar products and this lands somewhere in the middle."
335,Desk Lamp,Home,"so far, brightness settings are actually useful, but it started making an odd noise. I had to fiddle with it every single time. meh meh."
336,Skincare Serum,Beauty,"I grabbed this during a sale, the texture is lightweight, and it actually made my routine easier. Buttons and controls feel responsive. The texture is nicer than it looks in the photos. Kinda, I'm happy with this purchase."
337,Stainless Steel Pan,Kitchen,"After a week, it heats evenly once preheated, and it looks better in person! Setup took maybe five minutes! Ngl, I'm happy with this purchase! meh meh!"
338,Water Bottle,Outdoors,"After two months, it keeps drinks cold for hours, and the design is smart, but the materials feel average. The buttons feel mushy and inconsistent."
339,Laptop Stand,Office,"it keeps the screen at a better height, and it feels surprisingly premium. Even my picky friend said it was good. This replaced a name-brand version and honestly kept up. It runs a little warm, but not scary hot. Super, I'm happy with this purchase. lol"
340,Pet Hair Remover,Home,"I use this almost every day, it actually picks up fur, and it works really well. The instructions were clear for once."
341,Running Shoes,Fitness,"they felt broken-in pretty quickly, and it is easy to set up! It feels like someone actually tested this before shipping it!"
342,Coffee Maker,Kitchen,"the timer is straightforward, but it looks nice but performance is meh. It worked on day one and then slowly got worse. Compared with my last one, this somehow feels cheaper. Ngl, I expected more for the money."
343,Yoga Mat,Fitness,"I wanted to love this, it doesn't smell as bad as some mats do, and it feels surprisingly premium. Setup took maybe five minutes. Also, the color is a little darker than the listing."
344,Air Fryer,Kitchen,"I picked this up on a whim, fries come out crisp, and it holds up better than expected. I've dropped it once already and it still looks fine. Compared with my last one, this somehow feels cheaper. The zipper/snaps/lid could be smoother. Legit, I'm happy with this purchase."
345,Backpack,Travel,"there's enough room for a laptop and charger, but it keeps disconnecting randomly. Honestly it feels like a rushed design. Compared with my last one, this somehow feels cheaper. A bit, I expected more for the money."
346,Pet Hair Remover,Home,"I grabbed this during a sale, the handle is comfortable, and performance is good, but the finish scratches easily. It worked on day one and then slowly got worse. If you catch it on sale, it's easier to recommend."
347,Skincare Serum,Beauty,"it layers well under moisturizer, and it works fine most of the time, then randomly acts up. I had a similar item before and this one is easier to use."
348,Office Chair,Furniture,"Honestly, wheels roll smoothly, and it saved me a lot of time. No weird squeaks, no rattling, no drama. Compared with my old one, this is a clear upgrade. Weirdly enough, the smell went away after a day. A bit, I'm happy with this purchase. lol"
349,Portable Charger,Electronics,"it got me through a full day out, and it works really well. I've tried two similar products and this lands somewhere in the middle. Also, the color is a little darker than the listing."
350,Pet Hair Remover,Home,"So far, it works on the couch and car seats, and the main function is solid but the little details need work! It feels like someone actually tested this before shipping it! This replaced a name-brand version and honestly kept up! One weird thing: the cable is shorter than I wanted!"
351,Skincare Serum,Beauty,"I picked this up on a whim, the texture is lightweight, and I would recommend it with a couple caveats. If you catch it on sale, it's easier to recommend."
352,Stainless Steel Pan,Kitchen,"Tried it right out of the box, it browned food nicely, but it doesn't fit as well as advertised! The buttons feel mushy and inconsistent! I had a similar item before and this one is easier to use! Legit, I expected more for the money!"
353,Backpack,Travel,"Tried it right out of the box, the zipper feels decent, but it didn't live up to the hype. I had to fiddle with it every single time. bad bad."
354,Air Fryer,Kitchen,"I was skeptical at first, it cooks evenly for the most part, but it looks nice but performance is meh. Customer support replied slowly and didn't really help."
355,Water Bottle,Outdoors,"I grabbed this during a sale, it fits in my bag side pocket, but it has inconsistent quality!"
356,Water Bottle,Outdoors,"I wanted to love this, it fits in my bag side pocket, and it looks better in person. I expected average and got better than average. Kinda, I'm happy with this purchase."
357,Vacuum Cleaner,Home,"I was skeptical at first, it gets under the couch better than expected, and there's a lot to like here, but it isn't perfect. It feels like someone actually tested this before shipping it."
358,Stainless Steel Pan,Kitchen,"I picked this up on a whim, it browned food nicely, and it cleans up fast. Setup took maybe five minutes. Tiny complaint, the packaging was overkill. lol"
359,Wireless Earbuds,Electronics,"I use this almost every day, the case snaps shut nicely, and the main function is solid but the little details need work! Compared with my last one, this somehow feels cheaper!"
360,Stainless Steel Pan,Kitchen,"My partner uses this too, it browned food nicely, and it packs nicely for travel! The finish still looks clean after daily use!"
361,Air Fryer,Kitchen,"it cooks evenly for the most part, and it does exactly what I needed. No weird squeaks, no rattling, no drama. I expected it to be worse than my previous one, but it wasn't."
362,Desk Lamp,Home,"I grabbed this during a sale, brightness settings are actually useful, and it does the job, just not as smoothly as I'd hoped. No weird squeaks, no rattling, no drama. I've tried two similar products and this lands somewhere in the middle."
363,Mechanical Keyboard,Electronics,"the switch feel is consistent, and it does exactly what I needed. Even my picky friend said it was good."
364,Skincare Serum,Beauty,"So far, it didn't irritate my skin, and it has great battrey life. Nothing fancy, just solid and dependable. Compared with my old one, this is a clear upgrade. It runs a little warm, but not scary hot. lol"
365,Coffee Maker,Kitchen,"I wanted to love this, cleanup isn't terrible, but it arrived scratched. The material picks up dust and scratches way too easily. I expected it to be worse than my previous one, but it wasn't. Might return it if the issue gets any worse."
366,Water Bottle,Outdoors,"I picked this up on a whim, the lid seals well, and it made a noticeable difference."
367,Yoga Mat,Fitness,"My partner uses this too, it rolls up easily, and it is easy to set up. Setup took maybe five minutes. Minor note: it fingerprints pretty easily."
368,Coffee Maker,Kitchen,"the carafe pours without dripping most of the time, and it feels surprisingly premium. Setup took maybe five minutes. Tbh, I'm happy with this purchase. love love."
369,Backpack,Travel,"For the price, the straps are comfortable, but it is more flimsy than the photos. The photos online make it look nicer than it is."
370,Vacuum Cleaner,Home,"Tried it right out of the box, it handles pet hair decently, but it stopped working way too soon. Compared with my last one, this somehow feels cheaper."
371,Yoga Mat,Fitness,"I was skeptical at first, the cushioning feels balanced, and it works fine most of the time, then randomly acts up. The buttons feel mushy and inconsistent."
372,Portable Charger,Electronics,"Tried it right out of the box, it got me through a full day out, and it holds up better than expected. No weird squeaks, no rattling, no drama."
373,Office Chair,Furniture,"I was skeptical at first, assembly was manageable, but it showed up with a weird smell! I had to fiddle with it every single time!"
374,Portable Charger,Electronics,"it got me through a full day out, and it feels sturdy and well made."
375,Monitor Arm,Office,"it freed up desk space, and it has been super reliable! Buttons and controls feel responsive! Compared with my last one, this somehow feels cheaper! Also, the color is a little darker than the listing!"
376,Desk Lamp,Home,"after a week, brightness settings are actually useful, but it looks nice but performance is meh. The finish started wearing off almost immediately."
377,Coffee Maker,Kitchen,"Quick review, the carafe pours without dripping most of the time, and it packs nicely for travel. Nothing fancy, just solid and dependable."
378,Coffee Maker,Kitchen,"I grabbed this during a sale, the carafe pours without dripping most of the time, but it was kinda disappointing overall. Customer support replied slowly and didnt really help."
379,Phone Case,Electronics,"honestly, it doesn't add too much bulk, and it fits perfectly. Even my picky friend said it was good. Pretty much, I'm happy with this purchase."
380,Air Fryer,Kitchen,"So far, it cooks evenly for the most part, and it is quieter than I expected. The finish still looks clean after daily use. I've tried two similar products and this lands somewhere in the middle. Super, I'm happy with this purchase."
381,Backpack,Travel,"I wanted to love this, there's enough room for a laptop and charger, and it is comfortable even after long use. The finish still looks clean after daily use. I've tried two similar products and this lands somewhere in the middle. lol"
382,Mechanical Keyboard,Electronics,"the keys sound satisfying, but it keeps disconnecting randomly. Honestly it feels like a rushed design."
383,Stainless Steel Pan,Kitchen,"Been using it daily, it browned food nicely, and it is easy to set up. A bit, I'm happy with this purchase."
384,Stainless Steel Pan,Kitchen,"it browned food nicely, and the main function is solid but the little details need work. Nothing fancy, just solid and dependable. I've tried two similar products and this lands somewhere in the middle."
